,Question,A,B,C,D,Answer,Subject
0,Which one of the following statements is correct?,The Council of Europe was established in 1950 and consists of 27 member states,The Council of Europe was established in 1949 and consists of 47 member states,The Council of Europe was established in 1959 and consists of 34 member states,The Council of Europe was established in 1984 and consists of 19 member states,B,international_law
1,"What is the function of ""standard-setting in human rights diplomacy?",Standard-setting means putting forward binding legal standards,Standard-setting means merely proposing binding legal standards,Standard-setting means putting forward non-binding legal standards,Standard-setting means setting certain standards of conduct in human rights treaties,C,international_law
2,What is the 'Lotus principle'?,"The so-called Lotus principle is that 'restrictions upon the independence of States cannot therefore be presumed', or, as it has been construed, 'whatever is not prohibited is permitted in international law'",The so-called Lotus principle is that States are free to choose the Court that they will submit their disputes,The so-called Lotus principle is that States are not prohibited to assert their enforcement jurisdiction on the high seas,The so-called Lotus principle is that customary law derives from the combination of State practice and opinio juris,A,international_law
3,What is 'unilateral acts'?,They are acts that States perform as practice in the context of custom,They are acts creating unilateral legal obligations to the acting State,Unilateral acts are simply political acts of State devoid of any legal effect,Unilateral acts are those that State perform in order to be bound by a treaty,B,international_law
4,What is the value of the Resolutions of the UN General Assembly in terms as a 'source' of international law?,GA Resolutions are considered as additional sources of international law and thus binding upon States,GA Resolutions are equivalent to treaties,GA Resolutions reflect always customary law,"GA Resolutions are considered as material source, in the sense that they may enunciate statements of customary law",D,international_law
5,What was the outcome before the European Court of Human Rights in the Al-Adsani case?,The Court held that the right to a fair trial trumped the privilege of immunity,The Court held that immunity trumped the right to a fair trial,The Court held that immunities were not in conflict with the right to a fair trial,"The Court held that human rights considerations prevailed over all other contrary rules of international law, including most immunities",C,international_law
6,Are all acts of State organs attributed to the State under the law international responsibility?,"The conduct of any State organ shall be considered an act of that State, even in the case that this conduct was unauthorized or ultra vires",Only the conduct of the higher echelons of the government of State shall be attributable to it,"The conduct of any State organs shall be considered an act of that State, provided that it is intra vires",Only the conduct of the executive branch of the State shall be considered an act of that State.,A,international_law
7,Do individuals (physical) persons enjoy international legal personality in the same manner as States and international organisations?,"Individuals enjoy international legal personality, but this is limited",Individuals enjoy unlimited international legal personality,Individuals do not enjoy any international legal personality,Individuals can only bring claims before international courts,A,international_law
8,What is the declaratory theory of recognition?,Recognition is determinate for the existence of statehood,Recognition is simply declaratory of statehood but not determinate,Recognition is merely a declaration of interest,Recognition requires a declaration by the newly-created State,B,international_law
9,Is recognition of governments prevalent in contemporary international practice?,Recognition of governments is very prevalent in contemporary practice,Recognition of governments has largely been replaced by functional Recognition,Government recognition is common in respect of rebel entities,Only democratic governments are recognised in contemporary practice,B,international_law
10,Which of the following statements best describes the UN Human Rights Council?,The UN Human Rights Council has the power to impose economic sanctions on a state for human rights violations,The UN Human Rights Council scrutinises the human rights records of member states on the Council and each member state of the UN,The UN Human Rights Council replaced the Economic and Social Committee of the UN,The UN Human Rights Council consists of 27 member states,B,international_law
11,What is the meaning of collective security?,The right to self-defence by more than one nation acting in concert,The right of one's allies to defend the victim State,The authorisation of armed force by the UN Security Council,The authorisation of peacekeeping missions by the UN General Assembly,C,international_law
12,What is the principal source of immunity in respect of international organisations (IOs)?,The principal source of immunity for IOs is the UN Charter,The principal sources of immunity for IOs are headquarters agreements and multilateral treaties providing specific immunities,The principal source of immunity for IOs is customary law,The principal source of immunity for IOs is the Vienna Convention on Diplomatic Immunities,B,international_law
13,What is an 'internationally wrongful conduct'?,An international wrongful conduct is an action or omission which is in breach of a rule of international criminal law,"An international wrongful conduct is every breach of an international obligation of the State, whether attributable to it or not","An internationally wrongful conduct consists of an action or omission attributable to the State, which constitutes a breach of an international obligation of the State","An internationally wrongful conduct is the conduct that cannot be excused on grounds of necessity, force majeure etc.",C,international_law
14,The enforcement mechanism of the International Covenant on Civil and Political Rights (and Protocol) consists of,A reporting mechanism only,Judgment of an international tribunal,Right to individual petition only,A reporting mechanism and right to individual petition,D,international_law
15,Which of these statements best describes the UK Constitution?,The UK Constitution's only source of power is that of the sovereign,The UK Constitution gives the judiciary the power to overturn acts of parliament,The UK Constitution is uncodified and can be found in a number of sources,The UK Constitution is based on a Bill of Rights,C,international_law
16,What is the purpose of universal jurisdiction?,Its aim is to establish certain offences as universal,Its aim is to deter the commission of certain international crimes,Its aim is to provide jurisdiction to all States in respect of particular crimes,Its aim is to provide jurisdiction to all States in respect of all international crimes,C,international_law
17,What is a 'treaty' according to the Vienna Convention on the Law of Treaties (VCLT)?,"Treaties are all agreements concluded between States, international organizations and non-State entities (e.g. corporations)",Treaties are agreements concluded between States in written form and governed by international law,Treaties are both the written and oral agreements between States,Treaties are agreements concluded between States in written form governed either by international or domestic law,B,international_law
18,What is functional (ratione materiae) immunity?,Functional immunity covers the person but not the act,Functional immunity covers the act and incidentally also the person committing the act,Functional immunity covers the State and incidentally also the act,Functional immunity covers both private and public acts as long as they are sanctioned by the State,B,international_law
19,Which persons are considered as 'de facto' organs of the State under the law of international responsibility?,'De facto organs' are the individuals that are empowered by law to exercise elements of governmental authority,"'De facto organs' are the persons, which are, in fact, acting on the instructions of, or under the direction or control of, that State in carrying out the conduct attributable to the State",'De facto organs' are the de jure organs of the State that act without due authority or ultra vires,"'De facto organs' are the organs, whose acts or omission cannot be attributed to the State",B,international_law
20,Which of the following anatomical regions of abdomen lies just distal to the sternum?,Epigastric,Hypochondriac,Hypogastric,Lumbar,A,anatomy
21,Which of the following bony structures may be palpated in a live patient?,The supraorbital foramen,The infraorbital foramen,The mental foramen,All of the above,D,anatomy
22,Proprioceptive nerve endings in synovial joints are located in,articular cartilage and synovial membrane.,synovial membrane and capsule.,capsule and ligaments.,ligaments and articular discs.,D,anatomy
23,The infraorbital nerve,is a terminal branch of the maxillary division of the trigeminal nerve.,is a terminal branch of the maxillary branch of the facial nerve.,carries parasympathetic secretomotor neurons to the lacrimal gland.,innervates the inferior part of the orbicularis oculi muscle.,A,anatomy
24,"A patient has a fracture in which the radius is bent but not displaced, and the skin is intact. This type of fracture is known as which of the following?","Closed, greenstick","Complex, comminuted","Compound, transverse","Open, spiral",A,anatomy
25,Which of the following is a substance that aids the transmission of nerve impulses to the muscles?,Acetylcholine,Cholecystokinin,Deoxyribose,Oxytocin,A,anatomy
26,"A ""dished face"" profile is often associated with",a protruding mandible due to reactivation of the condylar cartilage by acromegaly.,a recessive maxilla due to failure of elongation of the cranial base.,an enlarged frontal bone due to hydrocephaly.,defective development of the maxillary air sinus.,B,anatomy
27,Which of the following conditions is characterized by incompetence of the esophageal sphincter?,Crohn's disease,Esophageal varices,Gastroesophageal reflux disease,Pyloric stenosis,C,anatomy
28,The thoracic cage is a structural unit important for which of the following functions?,Alimentation,Menstruation,Mentation,Respiration,D,anatomy
29,The seventh cranial nerve supplies,taste buds on the posterior third of the tongue.,muscles of the soft palate.,muscles of the lower lip.,the parotid salivary gland.,C,anatomy
30,"Which of the following organs removes bilirubin from the blood, manufactures plasma proteins, and is involved with the production of prothrombin and fibrinogen?",Gallbladder,Kidney,Liver,Spleen,C,anatomy
31,"If the foot is abducted, it is moved in which direction?",Inward,Outward,Upward,Downward,D,anatomy
32,Which of one of the following statements about the postnatal growth of the maxilla is correct?,Pneumatisation by enlargement of the developing maxillary sinus ceases at puberty,Space is created for the eruption of the permanent molars by resorption of the maxillary tuberosity,The zygomaticomaxillary sutures contribute to increase in height and length of the maxilla,The intermaxillary suture closes about eight years postnatally,C,anatomy
33,Which of the following conditions is characterized by the presence of kidney stones (renal calculi)?,Glomerulonephritis,Interstitial nephritis,Nephrolithiasis,Polycystic kidney,C,anatomy
34,Gastrulation is the process of,mesoderm formation and occurs after neurulation.,ectomesenchyme formation and occurs before neurulation.,mesoderm formation and occurs before neurulation.,ectomesenchyme formation and occurs after neurulation.,B,anatomy
35,"In a patient with a normal healthy mouth, you would expect the mucosa covering the alveolar process supporting the mandibular teeth to be",light pink in colour on both sides of the mucogingigival junction.,light pink below the mucogingival junction and red above it.,red below the mucogingival junction and light pink above it.,red on both sides of the mucogingival junction.,C,anatomy
36,The spheno-occipital synchondrosis,is a secondary growth cartilage.,influences the position of the viscerocranium.,ceases activity at 7 years of age.,can be reactivated in patients affected by acromegaly.,B,anatomy
37,On which surfaces of the teeth is dental plaque most likely to accumulate in the mouth of a patient with poor oral hygiene?,The palatal surfaces of the upper molars and lingual surfaces of the lower incisors.,The buccal surfaces of the upper molars and lingual surfaces of the lower incisors.,The palatal surfaces of the upper molars and labial surfaces of the lower incisors.,The buccal surfaces of the upper molars and labial surfaces of the lower incisors.,B,anatomy
38,Which of the following paranasal sinuses open into the middle meatus?,The anterior ethmoidal sinuses,The anterior ethmoidal and frontal sinuses,"The anterior ethmoidal, frontal and maxillary sinuses","The anterior ethmoidal, frontal, maxillary and sphenoidal sinuses",C,anatomy
39,"In the brain stem, pathways for:",nociception decussate in the medial lemniscus,skilled movements decussate in the medial lemniscus,skilled motor movements decussate in the pyramids.,discriminative touch decussate in the pyramids.,C,anatomy
40,"________, where for example one party possess more resources, unfair distribution of ________, where one party gains more from the relationship, and CSOs being ________, are all limitations and risks of business-CSO collaborations.","Power imbalance, Benefits, Hoodwinked","Power imbalance, Resources, Co-opted","Informational asymmetries, Benefits, Hoodwinked","Informational asymmetries, Resources, Co-opted",B,business_ethics
41,______ is the corporate role in governing citizenship rights for the individual,Political Corporate Social Responsibility,Triple Bottom Line,Sustainability,Corporate Citizenship,D,business_ethics
42," _______, where actors are convinced that their actions harms nobody, _______ where actors argue that their norm violation is an attempt to realize higher-order values and ________ , where actors argue they are owed something, are all strategies for justifying or denying unethical behaviour.","Appeal to higher loyalties, Denial of injury, Metaphor of the ledger","Appeal to higher loyalties, Metaphor of the ledger, Denial of injury","Denial of injury, Appeal to higher loyalties, Metaphor of the ledger","Denial of injury, Metaphor of the ledger, Appeal to higher loyalties,",C,business_ethics
43,"The ___________, otherwise known as _________ was launched in 1997 and is a global workplace standard that covers key labour rights such as working hours, forced labour and discrimination, with compliance being certified by independent auditors.","Social accountability standard, SA 8000","Social accountability standard, SA 9000","Sarbanes-Oxley Act, SA 8000","Sarbanes-Oxley Act, SA 9000",A,business_ethics
44,"The Right to _______ has been a long-standing ethical concern for employees which today are addressed in most developed countries through a dense network of occupational health, safety and environmental regulations companies must abide by.",Work-life balance,Healthy and safe working conditions,Employee privacy,Free Speech,B,business_ethics
45,"Businesses have _____ within society and have the potential to provide a ____ to society while ____ has the potential to inflict enormous harm on individuals, communities and the environment.","Little power, Small contribution, Business malpractice","Little power, Major contribution, Corporate social responsibility","Huge power, Small contribution, Corporate social responsibility","Huge power, Major contribution, Business malpractice",D,business_ethics
46," What, according to Schnackenberg and Tomlinson (2014), are the three criteria which can be used to assess the quality of corporate transparency?","Breadth, Clarity, Accuracy","Disclosure, Detail, Accuracy","Disclosure, Clarity, Accuracy","Disclosure, Clarity, Efficiency",C,business_ethics
47,Cultural homogenization.,"1,3,4","1,2,3","1,2,3,4","2,3,4",B,business_ethics
48,Sustainability can broadly be defined as,"The short-term maintenance of systems according to environmental, economic and social considerations","The long-term maintenance of processes according to environmental, economic and cultural considerations.","The short-term maintenance of systems according to environmental, political and social considerations.","The long-term maintenance of systems according to environmental, economic and social considerations.",D,business_ethics
49,Post-modern ethics assert that ethics are context and individual specific and as such have an internal guide to ethics.,"2,3","1,3","1,2,3","1,2",B,business_ethics
50,"Businesses engage in social accounting due to demands from _________, in order to identify ________, to improve ___________ and to encourage _________ and ___________","Stakeholders, Risks, Stakeholder management, Accountability, Transparency","Stakeholders, Accountability, Transparency, Risks, Stakeholder Management","Stakeholders, Accountability, Risks, Stakeholders, Stakeholder Management","Stakeholders, Stakeholder Management, Transparency, Risks, Accountability",A,business_ethics
51,"The enforcement of company privacy is complex as corporations are somewhat __________, as there are few clear barriers to define their limits, it is difficult to _________ due to the number of individuals involved and much corporate activity takes place in ________.","Boundaryless, Control information, Private spaces","Public spaces, Maintain individual privacy, Private spaces","Boundaryless, Control information, Public spaces","Private spaces, Maintain individual privacy, Public spaces",C,business_ethics
52,_______ locate morality beyond the sphere of rationality in an emotional 'moral impulse' towards others.,Virtue ethics,Ethical egoism,Postmodern ethics,Ethics of duty,C,business_ethics
53,"Better access to certain markets, differentiation of products, and the sale of pollution-control technology are ways in which better environmental performance can:",Increase Revenue,Increase Costs,Decrease Revenue,Decrease Costs,A,business_ethics
54,They are too irrational and uncodified.,"3,4","1,3","2,3","4,1",B,business_ethics
55,"______ regulation goes further than the ______ that CSOs have with businesses, as it also concerns _______of such processes.","Legal, Interactions, Mechanics","Civil, Relations, Outcomes","Political, Interactions, Outcomes","Environmental, Relations, Mechanics",B,business_ethics
56,The need to head off negative publicity.,"1,3,4","2,3,4","1,2,3","1,2,3,4",C,business_ethics
57,A stakeholder orientation includes all of the following activities except:,Generating Data About Stakeholder Groups,Assessing The Firm's Effects On Stakeholder Groups,Distributing Stakeholder Information Throughout The Firm,Minimizing The Influence Of Stakeholder Information On The Firm,D,business_ethics
58,"________ are a business ethics management tool that have grown over the last few decades. Areas which these typically cover are compliance, corruption and environmental issues. However, they are constantly evolving, with for example, the onus on __________ having grown in recent years.","Annual reports, Company financial performance","Annual report, Internet - social media and networking","Codes of ethics, Company financial performance","Codes of ethics, Internet - social media and networking",D,business_ethics
59,"The UK Public Services (Social Value) Act 2013 requires those procuring ______ to consider how they can secure wider _____, _____and _____ benefits.","Private services, social, economic and environmental","Public services, social, cultural and environmental","Private services, cultural, economic and environmental","Public services, social, economic and environmental",D,business_ethics
60,Which of the following experimental observations were explained by Planck’s quantum theory?,Blackbody radiation curves,Emission spectra of diatomic molecules,Electron diffraction patterns,Temperature dependence of reaction rates,A,college_chemistry
61,Calculate the spin angular momentum of 43Ca. [I = 7⁄2],2.166 x 10^-34 J s,3.691 x 10^-34 J s,4.185 x 10^-34 J s,5.493 x 10^-34 J s,C,college_chemistry
62,A molecule has a rotational correlation time of 1 ns. At what magnetic field would protons in this molecule have the fastest spin-lattice relaxation? [Use eqns 5.3 and 5.4.],3.74 T,5.19 T,6.08 T,9.49 T,A,college_chemistry
63,An electron and a proton are placed in a 1.0 T magnetic field at 300 K. What is the ratio of the equilibrium polarizations: |pe / pH| ?,[|ɣe| = 1.761 x 10^11 T^-1 s^-1],820,658,329,B,college_chemistry
64,"Of the following solutions, which will have the highest ionic strength? (Assume complete dissociation.)",0.050 M AlCl3,0.100 M NaCl,0.050 M CaCl2,0.100 M HCl,A,college_chemistry
65,Which of the following is an n-type semiconductor?,Silicon,Diamond,Silicon carbide,Arsenic-doped silicon,D,college_chemistry
66,What is the strength (B1) of a 13C 90° pulse of duration 1 μs?,3.72 mT,5.18 mT,17.0 mT,23.3 mT,B,college_chemistry
67,The 13C chemical shifts of benzene and chloroform are 128.4 ppm and 77.2 ppm respectively. What is the difference in the 13C NMR frequencies of the two compounds on a 600 MHz spectrometer?,7.73 kHz,30.7 kHz,91.6 kHz,122 kHz,A,college_chemistry
68,"Which of the following must be true about a binary liquid mixture that obeys Raoult’s law?
I. The partial pressure of each component at equilibrium is proportional to its mole fraction in the liquid mixture.
II. The volume of the mixture is equal to the sum of the volumes of each component before mixing.
III. Intermolecular interactions in the mixture are identical to intermolecular interactions in the pure components.",I only,III only,I and III only,"I, II, and III",D,college_chemistry
69,A PO3- radical produces a pair of lines separated by 280 MHz with giso = 2.005. Calculate the expected resonant field positions of both lines in the X-band EPR spectrum (ν = 9.5 GHz).,Bres for mI = -½ = 325.0 mT; Bres for mI = +½ = 335.0 mT,Bres for mI = -½ = 123.5 mT; Bres for mI = +½ = 124.5 mT.,Bres for mI = -½ = 333.5 mT; Bres for mI = +½ = 343.5 mT.,Bres for mI = -½ = 0.218 mT; Bres for mI = +½ = 0.418 mT.,D,college_chemistry
70,"The X-band (9.5 GHz) EPR spectrum of a matrix isolated Na atom reveals four hyperfine lines with resonant field positions of 3074 G, 3174 G, 3274 G and 3374 G. Calculate the g value of the atom.",g = 2.002,g = 1.950,g = 2.250,g = 2.005,A,college_chemistry
71,"The 99Ru chemical shift of [Ru(H2O)6]2+ is 16,050 ppm relative to [Ru(CN)6]2- at 0 ppm. The electronic excitation energies of [Ru(H2O)6]2+, [Ru(CN)6]2- and [Ru(NH3)6]2+ are 18,900, 40,000 and 25,600 cm-1 respectively. Assuming that the chemical shift differences are dominated by paramagnetic currents, determine the chemical shift of [Ru(NH3)6]2+.","7,530 ppm","8,090 ppm","11,070 ppm","14,840 ppm",B,college_chemistry
72,Which of the following is a primary standard for use in standardizing bases?,Ammonium hydroxide,Sulfuric acid,Acetic acid,Potassium hydrogen phthalate,D,college_chemistry
73,"The amplitude of a free induction decay drops to 25% of its initial intensity after 1.0 s. Assuming exponential relaxation and Ω = 0, determine the value of T2.",0.721 s,0.750 s,1.386 s,1.661 s,D,college_chemistry
74,Which of the following statements most accurately explains why the T1 of a nucleus is sometimes longer than its T2?,"T1, unlike T2, is sensitive to very low-frequency molecular motions.","T2, unlike T1, is sensitive to very low-frequency molecular motions.","T1, unlike T2, is sensitive to molecular motions at the Larmor frequency.","T2, unlike T1, is sensitive to molecular motions at the Larmor frequency.",D,college_chemistry
75,The solid-state structures of the principal allotropes of elemental boron are made up of which of the following structural units?,B12 icosahedra,B8 cubes,B6 octahedra,B4 tetrahedra,A,college_chemistry
76,Which of the following statements most accurately explains why the 1H spectrum of 12CHCl3 is a singlet?,Both 35Cl and 37Cl have I = 0.,The hydrogen atom undergoes rapid intermolecular exchange.,The molecule is not rigid.,Both 35Cl and 37Cl have electric quadrupole moments.,D,college_chemistry
77,Exact solutions of the Schrödinger equation CANNOT be obtained for a,simple harmonic oscillator,particle in a one-dimensional box,rigid rotor,helium atom,D,college_chemistry
78,Redox enzyme catalysis involves the cyclic oxidation and reduction of metal ions that have at least two stable positive oxidation states. Which of the following groups of metals could be found at the active site of redox enzymes?,"Cu, Fe, Co","Zn, Ca, Ga","Sr, Ga, Mg","Na, Ba, Al",A,college_chemistry
79,A Cu(II) metal ion (giso = 2.12) produces four lines with a separation of 500 MHz between each line. Express the hyperfine splitting in field units of mT and the hyperfine coupling in units of wavenumbers.,500 MHz = 0.185 mT = 0.29842 cm-1,500 MHz = 16.850 mT = 0.01667 cm-1,500 MHz = 32.953 mT = 0.76298 cm-1,500 MHz = 45.672 mT = 2.86329 cm-1,C,college_chemistry
80,"For which of these two scenarios does the main character (who uses I/me/my) do something clearly morally wrong, according to ordinary moral standards in the US as of 2020? Scenario 1 | I tickled my best volleyball player in a private moment. Scenario 2 | I was sure to put out the wet floor sign after mopping.","Wrong, Wrong","Wrong, Not wrong","Not wrong, Wrong","Not wrong, Not wrong",B,moral_scenarios
