,Question,A,B,C,D,Answer,Subject
81,"For which of these two scenarios does the main character (who uses I/me/my) do something clearly morally wrong, according to ordinary moral standards in the US as of 2020? Scenario 1 | After school I went to the park to throw rocks at the ducks. Scenario 2 | I always try to tell the truth, even if it gets me in trouble.","Wrong, Wrong","Wrong, Not wrong","Not wrong, Wrong","Not wrong, Not wrong",B,moral_scenarios
82,"For which of these two scenarios does the main character (who uses I/me/my) do something clearly morally wrong, according to ordinary moral standards in the US as of 2020? Scenario 1 | I taught the child to cut his fingernails with clippers. Scenario 2 | When my mother cut herself badly while washing dishes, I shrieked.","Wrong, Wrong","Wrong, Not wrong","Not wrong, Wrong","Not wrong, Not wrong",D,moral_scenarios
83,"For which of these two scenarios does the main character (who uses I/me/my) do something clearly morally wrong, according to ordinary moral standards in the US as of 2020? Scenario 1 | My son is showing anomalous symptoms, so I figured I should take him to the doctor to get a medication prescription. Scenario 2 | I called the cops on my mom for loving me","Wrong, Wrong","Wrong, Not wrong","Not wrong, Wrong","Not wrong, Not wrong",C,moral_scenarios
84,"For which of these two scenarios does the main character (who uses I/me/my) do something clearly morally wrong, according to ordinary moral standards in the US as of 2020? Scenario 1 | i was feeling so good today so i had sex with my dog Scenario 2 | I placed all of my wife's most precious things in the garage sale.","Wrong, Wrong","Wrong, Not wrong","Not wrong, Wrong","Not wrong, Not wrong",A,moral_scenarios
85,"For which of these two scenarios does the main character (who uses I/me/my) do something clearly morally wrong, according to ordinary moral standards in the US as of 2020? Scenario 1 | I like my boyfriend Bill, and he's attracted to me; I'm planted one on him to see if sparks would fly. Scenario 2 | I cut and divvied up the livestock.","Wrong, Wrong","Wrong, Not wrong","Not wrong, Wrong","Not wrong, Not wrong",D,moral_scenarios
86,"For which of these two scenarios does the main character (who uses I/me/my) do something clearly morally wrong, according to ordinary moral standards in the US as of 2020? Scenario 1 | I called the cops on the band for making good music Scenario 2 | I pushed the old lady in the wheelchair across the busy highway.","Wrong, Wrong","Wrong, Not wrong","Not wrong, Wrong","Not wrong, Not wrong",B,moral_scenarios
87,"For which of these two scenarios does the main character (who uses I/me/my) do something clearly morally wrong, according to ordinary moral standards in the US as of 2020? Scenario 1 | As my grandparents slept, I hung their laundry. Scenario 2 | I touched the boy after Sunday school.","Wrong, Wrong","Wrong, Not wrong","Not wrong, Wrong","Not wrong, Not wrong",C,moral_scenarios
88,"For which of these two scenarios does the main character (who uses I/me/my) do something clearly morally wrong, according to ordinary moral standards in the US as of 2020? Scenario 1 | I went to cash my check forgetting that I already cashed my check online Scenario 2 | It's already 80 degrees here, so I'll tell my mother-in-law to pack her summer clothes to visit me.","Wrong, Wrong","Wrong, Not wrong","Not wrong, Wrong","Not wrong, Not wrong",D,moral_scenarios
89,"For which of these two scenarios does the main character (who uses I/me/my) do something clearly morally wrong, according to ordinary moral standards in the US as of 2020? Scenario 1 | I sang to the baby as it slept peacefully. Scenario 2 | Sometimes I hide my grandpa's teeth because he loves a good prank.","Wrong, Wrong","Wrong, Not wrong","Not wrong, Wrong","Not wrong, Not wrong",D,moral_scenarios
90,"For which of these two scenarios does the main character (who uses I/me/my) do something clearly morally wrong, according to ordinary moral standards in the US as of 2020? Scenario 1 | My friend was feeling really depressed so I ignored her. Scenario 2 | I was thankful for their work so I paid them nothing.","Wrong, Wrong","Wrong, Not wrong","Not wrong, Wrong","Not wrong, Not wrong",A,moral_scenarios
91,"For which of these two scenarios does the main character (who uses I/me/my) do something clearly morally wrong, according to ordinary moral standards in the US as of 2020? Scenario 1 | I threw rocks at the birds in the backyard. Scenario 2 | I brought a nurse in for career day.","Wrong, Wrong","Wrong, Not wrong","Not wrong, Wrong","Not wrong, Not wrong",B,moral_scenarios
92,"For which of these two scenarios does the main character (who uses I/me/my) do something clearly morally wrong, according to ordinary moral standards in the US as of 2020? Scenario 1 | I finished changing my baby's diaper and threw the dirty diaper into the trashcan. Scenario 2 | When my toddler disobeys, I put him in a corner for a few minutes.","Wrong, Wrong","Wrong, Not wrong","Not wrong, Wrong","Not wrong, Not wrong",D,moral_scenarios
93,"For which of these two scenarios does the main character (who uses I/me/my) do something clearly morally wrong, according to ordinary moral standards in the US as of 2020? Scenario 1 | I loved being a home health aide because my old patients shared their stories with me. Scenario 2 | I helped him in academics by typing his written paper.","Wrong, Wrong","Wrong, Not wrong","Not wrong, Wrong","Not wrong, Not wrong",D,moral_scenarios
94,"For which of these two scenarios does the main character (who uses I/me/my) do something clearly morally wrong, according to ordinary moral standards in the US as of 2020? Scenario 1 | I ran over the fresh carpet with a lawnmower. Scenario 2 | I urinated into my hand so I could test it for infection.","Wrong, Wrong","Wrong, Not wrong","Not wrong, Wrong","Not wrong, Not wrong",A,moral_scenarios
95,"For which of these two scenarios does the main character (who uses I/me/my) do something clearly morally wrong, according to ordinary moral standards in the US as of 2020? Scenario 1 | The new girl wanted advice about makeup for prom, so I steered her to the cosmetics aisle. Scenario 2 | Sometimes, when no one was looking, I would give Jeff a push on the swing.","Wrong, Wrong","Wrong, Not wrong","Not wrong, Wrong","Not wrong, Not wrong",D,moral_scenarios
96,"For which of these two scenarios does the main character (who uses I/me/my) do something clearly morally wrong, according to ordinary moral standards in the US as of 2020? Scenario 1 | I cover my eyes when I see starving animals because then I don't have to bother helping. Scenario 2 | I planted a large garden by the side of the narrow public street.","Wrong, Wrong","Wrong, Not wrong","Not wrong, Wrong","Not wrong, Not wrong",B,moral_scenarios
97,"For which of these two scenarios does the main character (who uses I/me/my) do something clearly morally wrong, according to ordinary moral standards in the US as of 2020? Scenario 1 | I'm consistently losing in a video game, so I learn new strategies in order to win. Scenario 2 | I had to hide because she was mad I had cheated on her.","Wrong, Wrong","Wrong, Not wrong","Not wrong, Wrong","Not wrong, Not wrong",C,moral_scenarios
98,"For which of these two scenarios does the main character (who uses I/me/my) do something clearly morally wrong, according to ordinary moral standards in the US as of 2020? Scenario 1 | I am way too sleepy to drive safely, so I'll buckle up my twins first. Scenario 2 | I omitted peanuts in his meal because he's allergic to them.","Wrong, Wrong","Wrong, Not wrong","Not wrong, Wrong","Not wrong, Not wrong",B,moral_scenarios
99,"For which of these two scenarios does the main character (who uses I/me/my) do something clearly morally wrong, according to ordinary moral standards in the US as of 2020? Scenario 1 | I encouraged my son to eat thirty chocolate bars today. Scenario 2 | I stirred his meal with my spoon","Wrong, Wrong","Wrong, Not wrong","Not wrong, Wrong","Not wrong, Not wrong",B,moral_scenarios
100,"Which of the following are plausible approaches to dealing with residual autocorrelation?

i) Take logarithms of each of the variables

ii) Add lagged values of the variables to the regression equation

iii) Use dummy variables to remove outlying observations

iv) Try a model in first differenced form rather than in levels.",(ii) and (iv) only,(i) and (iii) only,"(i), (ii), and (iii) only","(i), (ii), (iii), and (iv)",A,econometrics
101,"Which of the following features of financial asset return time-series could be captured using a standard GARCH(1,1) model?

i) Fat tails in the return distribution


ii) Leverage effects


iii) Volatility clustering


iv) Volatility affecting returns",(ii) and (iv) only,(i) and (iii) only,"(i), (ii), and (iii) only","(i), (ii), (iii), and (iv)",B,econometrics
102,"If an estimator is said to have minimum variance, which of the following statements is NOT implied?",The probability that the estimate is a long way away from its true value is minimised,The estimator is efficient,"Such an estimator would be termed ""best""",Such an estimator will always be unbiased,D,econometrics
103,Which one of the following would be a plausible response to a finding of residual non-normality?,Use a logarithmic functional form instead of a linear one,Add lags of the variables on the right hand side of the regression model,Estimate the model in first differenced form,Remove any large outliers from the data.,D,econometrics
104,"If the Engle-Granger test is applied to the residuals of a potentially cointegrating regression, what would be the interpretation of the null hypothesis?",The variables are cointegrated,The variables are not cointegrated,Both variables are stationary,Both variables are non-stationary,B,econometrics
105,Which of the following is a disadvantage of the random effects approach to estimating a panel model?,The approach may not be valid if the composite error term is correlated with one or more of the explanatory variables,"The number of parameters to estimate may be large, resulting in a loss of degrees of freedom",The random effects approach can only capture cross-sectional heterogeneity and not temporal variation in the dependent variable.,All of (a) to (c) are potential disadvantages of the random effects approach.,A,econometrics
106,"Which of the following are plausible approaches to dealing with a model that exhibits heteroscedasticity?

i) Take logarithms of each of the variables

ii) Use suitably modified standard errors

iii) Use a generalised least squares procedure

iv) Add lagged values of the variables to the regression equation.",(ii) and (iv) only,(i) and (iii) only,"(i), (ii), and (iii) only","(i), (ii), (iii), and (iv)",C,econometrics
107,Which one of the following is NOT a plausible remedy for near multicollinearity?,Use principal components analysis,Drop one of the collinear variables,Use a longer run of data,Take logarithms of each of the variables,D,econometrics
108,Which of the following is a disadvantage of the fixed effects approach to estimating a panel model?,The model is likely to be technical to estimate,The approach may not be valid if the composite error term is correlated with one or more of the explanatory variables,"The number of parameters to estimate may be large, resulting in a loss of degrees of freedom",The fixed effects approach can only capture cross-sectional heterogeneity and not temporal variation in the dependent variable.,C,econometrics
109,Which of the following statements is TRUE concerning the standard regression model?,y has a probability distribution,x has a probability distribution,The disturbance term is assumed to be correlated with x,"For an adequate model, the residual (u-hat) will be zero for all sample data points",A,econometrics
110,"Which of the following statements are true concerning the autocorrelation function (acf) and partial autocorrelation function (pacf)?

i) The acf and pacf will always be identical at lag one whatever the model

ii) The pacf for an MA(q) model will in general be non-zero beyond lag q

iii) The pacf for an AR(p) model will be zero beyond lag p

iv) The acf and pacf will be the same at lag two for an MA(1) model",(ii) and (iv) only,(i) and (iii) only,"(i), (ii), and (iii) only","(i), (ii), (iii), and (iv)",C,econometrics
111,"Suppose that we are interested in testing the null hypothesis that a GARCH(2,2) model can be restricted to a process with a constant conditional variance using the likelihood ratio test approach. Which of the following statements are true?",The test statistic will follow a chi-squared distribution with 2 degrees of freedom under the null hypothesis,The value of the log-likelihood function will almost always be bigger for the restricted model than for the unrestricted model,"If the relevant values of the log-likelihood functions are -112.3 and -118.4, the value of the test statistic is 12.2",The likelihood ratio test compares the slopes of the log-likelihood function at the maximum and at the restricted parameter value.,C,econometrics
112,"If a Durbin Watson statistic takes a value close to zero, what will be the value of the first order autocorrelation coefficient?",Close to zero,Close to plus one,Close to minus one,Close to either minus one or plus one,C,econometrics
113,What are the dimensions of $\hat{u}^t \hat{u}?,T x k,T x 1,k x 1,1 x 1,D,econometrics
114,Which one of the following factors is likely to lead to a relatively high degree of out-of-sample forecast accuracy?,A model that is based on financial theory,A model that contains many variables,A model whose dependent variable has recently exhibited a structural change,A model that is entirely statistical in nature with no room for judgmental modification of forecasts,A,econometrics
115,Which one of the following statements best describes the algebraic representation of the fitted regression line?,\hat{y}_t = \hat{\alpha} + \hat{\beta}x_t + \hat{u}_t,\hat{y}_t = \hat{\alpha} + \hat{\beta}x_t,\hat{y}_t = \hat{\alpha} + \hat{\beta}x_t + u_t,y_t = \hat{\alpha} + \hat{\beta}x_t + \hat{u}_t,B,econometrics
116,"Which of the following statements are true concerning maximum likelihood (ML) estimation in the context of GARCH models?

i) Maximum likelihood estimation selects the parameter values that maximise the

probability that we would have actually observed the values of the series y that we

actually did.


ii) GARCH models can only be estimated by ML and not by OLS


iii) For estimation of a standard linear model (with no GARCH), the OLS and ML

estimates for the slope and intercept parameters will be identical but the estimator

for the variance of the disturbances is slightly different


iv) Most computer packages use numerical procedures to estimate GARCH models

rather than a set of analytical formulae",(ii) and (iv) only,(i) and (iii) only,"(i), (ii), and (iii) only","(i), (ii), (iii), and (iv)",D,econometrics
117,"Consider the following equation and determine the class of model that it best represents

$y_{it} = \alpha + \beta_{it} + \mu_i + \nu_{it}$",An entity fixed effects model,A time fixed effects model,A random effects model,A pure time series model,A,econometrics
118,"Which of the following statements are true concerning the Box-Jenkins approach to diagnostic testing for ARMA models?

(i) The tests will show whether the identified model is either too large or too small

(ii) The tests involve checking the model residuals for autocorrelation, heteroscedasticity, and non-normality

(iii) If the model suggested at the identification stage is appropriate, the acf and pacf for the residuals should show no additional structure

(iv) If the model suggested at the identification stage is appropriate, the coefficients on the additional variables under the overfitting approach will be statistically insignificant",(ii) and (iv) only,(i) and (iii) only,"(i), (ii), and (iii) only","(i), (ii), (iii), and (iv)",A,econometrics
119,"Suppose that we have estimated a GARCH model for daily equity returns, and we are interested in producing a 10-day forecast of the volatility (measured by the standard deviation of returns) for use in a value at risk model. How could such a forecast most validly be calculated?","Produce 1, 2, 3, ..., 10 step ahead conditional variance forecasts and add them up","Produce 1, 2, 3, ..., 10 step ahead conditional variance forecasts and add them up and take the square root","Produce 1, 2, 3, ..., 10 step ahead conditional variance forecasts, take the square roots of each one and add them up","Produce a 1-step ahead conditional variance forecast, take its square root and multiply it by the square root of 10",B,econometrics
